Last login: Fri Jan 13 12:39:41 on ttys000

The default interactive shell is now zsh.
To update your account to use zsh, please run `chsh -s /bin/zsh`.
For more details, please visit https://support.apple.com/kb/HT208050.
L-F0QFT6PL70:~ vintarohith$ /Library/PostgreSQL/15/scripts/runpsql.sh; exit
Server [localhost]: 
Database [postgres]: 
Port [5432]: 
Username [postgres]: 
Password for user postgres: 
psql (15.1)
Type "help" for help.

postgres=# \list
                                            List of databases
   Name    |  Owner   | Encoding | Collate | Ctype | ICU Locale | Locale Provider |   Access privileges   
-----------+----------+----------+---------+-------+------------+-----------------+-----------------------
 firstday  | postgres | UTF8     | C       | C     |            | libc            | 
 postgres  | postgres | UTF8     | C       | C     |            | libc            | 
 template0 | postgres | UTF8     | C       | C     |            | libc            | =c/postgres          +
           |          |          |         |       |            |                 | postgres=CTc/postgres
 template1 | postgres | UTF8     | C       | C     |            | libc            | =c/postgres          +
           |          |          |         |       |            |                 | postgres=CTc/postgres
(4 rows)

postgres=# \c
You are now connected to database "postgres" as user "postgres".
postgres=# CREATE TABLE employee(
postgres(# eid INT PRIMARY KEY NOT NULL,
postgres(# ename TEXT NOT NULL,
postgres(# salary REAL);
CREATE TABLE
postgres=# \D
invalid command \D
Try \? for help.
postgres=# /D
postgres-# \d
          List of relations
 Schema |   Name   | Type  |  Owner   
--------+----------+-------+----------
 public | employee | table | postgres
(1 row)

postgres-# \d employee
              Table "public.employee"
 Column |  Type   | Collation | Nullable | Default 
--------+---------+-----------+----------+---------
 eid    | integer |           | not null | 
 ename  | text    |           | not null | 
 salary | real    |           |          | 
Indexes:
    "employee_pkey" PRIMARY KEY, btree (eid)


postgres=# \d
          List of relations
 Schema |   Name   | Type  |  Owner   
--------+----------+-------+----------
 public | employee | table | postgres
(1 row)

postgres=# \d
          List of relations
 Schema |   Name   | Type  |  Owner   
--------+----------+-------+----------
 public | employee | table | postgres
(1 row)

postgres=# INSERT INTO employee (eid,ename,salary)
postgres-# values(101,'Rohith',100000)
postgres-# INSERT INTO employee
postgres-# values(102,'Jaideep',200000)
postgres-# 
postgres-# \d
          List of relations
 Schema |   Name   | Type  |  Owner   
--------+----------+-------+----------
 public | employee | table | postgres
(1 row)

postgres=# /c
postgres-# \c firstDay
connection to server at "localhost" (127.0.0.1), port 5432 failed: could not initiate GSSAPI security context:  Miscellaneous failure (see text): Matching credential (postgres/localhost@BFL.COM) not found
connection to server at "localhost" (127.0.0.1), port 5432 failed: FATAL:  database "firstDay" does not exist
Previous connection kept
postgres-# \c firstday
You are now connected to database "firstday" as user "postgres".
firstday-# INSERT INTO employee(eid,ename,salary)
firstday-# values(101,'Rohith',100000);
firstday=# \c postgres
You are now connected to database "postgres" as user "postgres".
postgres=# \d
          List of relations
 Schema |   Name   | Type  |  Owner   
--------+----------+-------+----------
 public | employee | table | postgres
(1 row)

postgres=# \d employee
              Table "public.employee"
 Column |  Type   | Collation | Nullable | Default 
--------+---------+-----------+----------+---------
 eid    | integer |           | not null | 
 ename  | text    |           | not null | 
 salary | real    |           |          | 
Indexes:
    "employee_pkey" PRIMARY KEY, btree (eid)

postgres=# INSERT INTO employee
postgres-# values(1002,'Rohan',30000);
INSERT 0 1
postgres=# INSERT INTO employee
postgres-# values(54728,'Rahul',5938950);
INSERT 0 1
postgres=# select * from employee
postgres-# ;
  eid  |  ename  |   salary    
-------+---------+-------------
   102 | Jaideep |       80000
  1001 | Rohith  |      200000
  1002 | Rohan   |       30000
 54728 | Rahul   | 5.93895e+06
(4 rows)

postgres=# DELETE FROM employee where eid = 54728;
DELETE 1
postgres=# select * from employee
;
 eid  |  ename  | salary 
------+---------+--------
  102 | Jaideep |  80000
 1001 | Rohith  | 200000
 1002 | Rohan   |  30000
(3 rows)

postgres=# UPDATE employee SET ename='Rohith',salary=90000 
postgres-# WHERE eid=1001;
UPDATE 1
postgres=# select * from employee
;
 eid  |  ename  | salary 
------+---------+--------
  102 | Jaideep |  80000
 1002 | Rohan   |  30000
 1001 | Rohith  |  90000
(3 rows)

postgres=# select * from employee where eid = 1001;
 eid  | ename  | salary 
------+--------+--------
 1001 | Rohith |  90000
(1 row)

postgres=# select concat (ename,salary) from employee;
    concat    
--------------
 Jaideep80000
 Rohan30000
 Rohith90000
(3 rows)

postgres=# select concat (ename , salary) from employee;
    concat    
--------------
 Jaideep80000
 Rohan30000
 Rohith90000
(3 rows)

postgres=# select SUM(salary) FROM employee
postgres-# ;
  sum   
--------
 200000
(1 row)

postgres=# select AVG(salary) FROM employee;
        avg        
-------------------
 66666.66666666667
(1 row)

postgres=# select count (eid),ename from employee group by ename;
 count |  ename  
-------+---------
     1 | Rohith
     1 | Jaideep
     1 | Rohan
(3 rows)

postgres=# select * from employee order by eid;
 eid  |  ename  | salary 
------+---------+--------
  102 | Jaideep |  80000
 1001 | Rohith  |  90000
 1002 | Rohan   |  30000
(3 rows)

postgres=# select * from employee order by eid desc;
 eid  |  ename  | salary 
------+---------+--------
 1002 | Rohan   |  30000
 1001 | Rohith  |  90000
  102 | Jaideep |  80000
(3 
posters=# create table department(did INT PRIMARY KEY NOT NULL, name text);
CREATE TABLE
postgres=# \d
           List of relations
 Schema |    Name    | Type  |  Owner   
--------+------------+-------+----------
 public | department | table | postgres
 public | employee   | table | postgres
(2 rows)

postgres=# values('p1','p2');
 column1 | column2 
---------+---------
 p1      | p2
(1 row)

postgres=# 
postgres=# insert into department(did,name)
values()
insert into department(did,name)
postgres-# values('p1','p2,'p3');
postgres'# 
postgres'# 
postgres'# 
postgres'# 
postgres'# values('p1','p2');
postgres'# 
postgres'# insert into department(did,name)
values()
insert into department(did,name);
postgres'# values('p1','p2');
postgres'# 
postgres'# 
postgres'# 
postgres'# 
postgres'# insert into department(did,name)
values()
insert into department(did,name)
postgres'# values()
postgres'# 
postgres'# CREATE TABLE employee(eid INT PRIMARY KEY NOT NULL,ename TEXT NOT NULL, SALARY REAL,FOEIGN KEY(did))
postgres'# REFERENCES department(did));
postgres'# 
postgres'# \d
postgres'# 
postgres'# create table department(did INT PRIMARY NOT NULL, name text)
CREATE TABLE
;
postgres'# alter table employee
postgres'# add constraint
postgres'# emp_dep foreign key(did)
postgres'# references department(did)
postgres'# ;
postgres'# 
postgres'# ALTER TABLE EMPLOYEE
postgres'# ADD FOREIGN KEY (did)
postgres'# REFERENCES department(did);
postgres'# 
postgres'# select * from employee;
postgres'# 
postgres'# 
postgres'# 
postgres'# 
